sentence,hanzi,pinyin
I can make grass grow!,我能让草生长!,wǒ néng ràng cǎo shēng zhǎng !
She was close to realizing a lifetime goal.,她即将实现她的人生目标。,tā jí jiāng shí xiàn tā de rén shēng mù biāo 。
Trees are truly life savers as they help reduce pollution.,树木是真正的救生员，因为它们有助于减少污染。,shù mù shì zhēn zhèng de jiù shēng yuán ， yīn wéi tā mén yǒu zhù yú jiǎn shǎo wū rǎn 。
"The climate on the coast is hot, humid, and unhealthy.",沿海地区的气候炎热、潮湿、不健康。,yán hǎi dì qū de qì hòu yán rè 、 cháo shī 、 bù jiàn kāng 。
Leafs are turning yellow due to dry weather.,由于天气干燥，树叶正在变黄。,yóu yú tiān qì gàn zào ， shù yè zhèng zài biàn huáng 。
The summer had been very dry and no berries grew.,夏天非常干燥，没有浆果生长。,xià tiān fēi cháng gàn zào ， méi yǒu jiāng guǒ shēng zhǎng 。
The rocks are not too high to climb.,岩石不太高，能爬上去。,yán shí bù tài gāo ， néng pá shàng qù 。
Fruits are beneficial for health as they provide energy to work.,水果有益健康，因为它们提供工作的能量。,shuǐ guǒ yǒu yì jiàn kāng ， yīn wéi tā mén tí gòng gōng zuò de néng liàng 。
His shoes were covered with mud when he entered the house.,他进屋时，鞋上沾满了泥。,tā jìn wū shí ， xié shàng zhān mǎn le ní 。
Indoor plants makes the house look attractive and pleasing.,室内植物使房子看起来漂亮宜人。,shì nèi zhí wù shǐ fáng zǐ kàn qǐ lái piāo liàng yí rén 。
How bright a star can be? Have you ever thought about this?,一颗星星能有多亮?你有没有想过这个问题?,yī kē xīng xīng néng yǒu duō liàng ? nǐ yǒu méi yǒu xiǎng guò zhè gè wèn tí ?
I wonder how the tree got so tall.,我想知道这棵树是怎么长得这么高的。,wǒ xiǎng zhī dào zhè kē shù shì zěn me zhǎng dé zhè me gāo de 。
They have yet to see the big beautiful white rock.,他们还没有看到那块又大又漂亮的白色岩石。,tā mén hái méi yǒu kàn dào nà kuài yòu dà yòu piāo liàng de bái sè yán shí 。
I keep wondering why birds evolved to fly.,我一直想知道为什么鸟类进化成会飞的。,wǒ yī zhí xiǎng zhī dào wéi shén me niǎo lèi jìn huà chéng huì fēi de 。
I don't know what to pick.,我不知道该选什么。,wǒ bù zhī dào gāi xuǎn shén me 。
I have just about finished picking the berries.,我差不多摘完了浆果。,wǒ chà bù duō zhāi wán le jiāng guǒ 。
The climate is hot and very humid.,气候又热又潮湿。,qì hòu yòu rè yòu cháo shī 。
The scenery of the valley is just amazing.,山谷的景色真是令人惊叹。,shān gǔ de jǐng sè zhēn shì lìng rén jīng tàn 。
"The boy was no longer sleepy, but full of energy and excitemént.",那男孩不再困倦，而是充满了活力和兴奋。,nà nán hái bù zài kùn juàn ， ér shì chōng mǎn le huó lì hé xìng fèn 。
She covered her head as dirt rained over her.,泥土如雨点般落在她身上，她捂着头。,ní tǔ rú yǔ diǎn bān luò zài tā shēn shàng ， tā wǔ zhe tóu 。
It shouldn't be hard to dig in this sand.,在这样的沙地里挖土应该不难。,zài zhè yàng de shā dì lǐ wā tǔ yìng gāi bù nán 。
"There it was cool and quiet, with a scent of ripe fruit.",那里凉爽而宁静，散发着成熟水果的香味。,nà lǐ liáng shuǎng ér níng jìng ， sàn fā zhe chéng shú shuǐ guǒ de xiāng wèi 。
Sunny in the morning but mostly cloudy by the evening.,早上有阳光，但晚上大部分时间多云。,zǎo shàng yǒu yáng guāng ， dàn wǎn shàng dà bù fēn shí jiān duō yún 。
He went abroad to study higher.,他出国深造去了。,tā chū guó shēn zào qù le 。
Children were playing in park with a ball.,孩子们在公园里玩球。,hái zǐ mén zài gōng yuán lǐ wán qiú 。
The bird won't let me nearby.,这只鸟不让我靠近。,zhè zhī niǎo bù ràng wǒ kào jìn 。
I have eaten a piece of fruit.,我吃了一块水果。,wǒ chī le yī kuài shuǐ guǒ 。
Everything was budding and blossoming.,万物都在含苞待放。,wàn wù dōu zài hán bāo dài fàng 。
I will always be with you.,我会永远和你在一起。,wǒ huì yǒng yuǎn hé nǐ zài yī qǐ 。
"The sun had set, and dusk settled over the ocean.",太阳已经落山，暮色笼罩着海面。,tài yáng yǐ jīng luò shān ， mù sè lóng zhào zhe hǎi miàn 。
He is one of the best players.,他是最好的球员之一。,tā shì zuì hǎo de qiú yuán zhī yī 。
"Sitting, that is the main thing to consider.",坐着，这是要考虑的主要问题。,zuò zhe ， zhè shì yào kǎo lǜ de zhǔ yào wèn tí 。
"The sight, sound, and scent of the ocean helped her relax.",海洋的景象、声音和气味帮助她放松下来。,hǎi yáng de jǐng xiàng 、 shēng yīn hé qì wèi bāng zhù tā fàng sōng xià lái 。
There are clouds over the hills.,山上有云。,shān shàng yǒu yún 。
The sky is over my head.,天空在我的头顶上。,tiān kōng zài wǒ de tóu dǐng shàng 。
My house is across the bank.,我的房子在银行对面。,wǒ de fáng zǐ zài yín háng duì miàn 。
"You should expect any weather from scorching hot to cold, wet and windy.",你应该预料到从炎热到寒冷、潮湿和多风的任何天气。,nǐ yìng gāi yù liào dào cóng yán rè dào hán lěng 、 cháo shī hé duō fēng de rèn hé tiān qì 。
I have a pool behind my house.,我的房子后面有一个游泳池。,wǒ de fáng zǐ hòu miàn yǒu yī gè you yǒng chí 。
I have done this task for your benefit.,我做这项工作是为了你的利益。,wǒ zuò zhè xiàng gōng zuò shì wéi le nǐ de lì yì 。
We cannot live without water.,没有水我们就不能生存。,méi yǒu shuǐ wǒ mén jiù bù néng shēng cún 。
It's my pleasure to help you.,帮助你是我的荣幸。,bāng zhù nǐ shì wǒ de róng xìng 。
Playing is his only job.,玩耍是他唯一的工作。,wán shuǎ shì tā wéi yī de gōng zuò 。
We need to walk as far as we can tonight.,今晚我们得走得越远越好。,jīn wǎn wǒ mén dé zǒu dé yuè yuǎn yuè hǎo 。
She throws rocks just about every day.,她几乎每天都扔石头。,tā jǐ hū měi tiān dōu rēng shí tóu 。
If you have the money use it wisely.,如果你有钱，明智地使用它。,rú guǒ nǐ yǒu qián ， míng zhì de shǐ yòng tā 。
Someone is at the door.,有人在门口。,yǒu rén zài mén kǒu 。
Let's look at how this happened.,让我们看看这是怎么发生的。,ràng wǒ mén kàn kàn zhè shì zěn me fā shēng de 。
You better listen up.,你最好听好了。,nǐ zuì hǎo tīng hǎo le 。
We are sure of success.,我们一定会成功。,wǒ mén yī dìng huì chéng gōng 。
He is quite punctual in following routines.,他在以后的日常活动中都很准时。,tā zài yǐ hòu de rì cháng huó dòng zhōng dōu hěn zhǔn shí 。
I got your flowers but I forgot what they were for.,我收到了你的花，但我忘了它们是干什么用的。,wǒ shōu dào le nǐ de huā ， dàn wǒ wàng le tā mén shì gàn shén me yòng de 。
He has been loving that one tree's fruit.,他一直很爱那棵树的果实。,tā yī zhí hěn ài nà kē shù de guǒ shí 。
This activity should not be attempted in windy conditions.,这种活动不应该在多风的条件下进行。,zhè zhǒng huó dòng bù yìng gāi zài duō fēng de tiáo jiàn xià jìn háng 。
The research I found on the topic was limited.,我在这方面的研究是有限的。,wǒ zài zhè fāng miàn de yán jiū shì yǒu xiàn de 。
Where does all the rain water go?,雨水都到哪里去了?,yǔ shuǐ dōu dào nǎ lǐ qù le ?
"Nature was at her peak, blending the wild blooms with various shades of green.",大自然正处于它的巅峰，将野花与各种深浅的绿色融为一体。,dà zì rán zhèng chù yú tā de diān fēng ， jiāng yě huā yǔ gè zhǒng shēn qiǎn de lǜ sè róng wéi yī tǐ 。
"Water was dripping from the trees, and the grass was wet.",水从树上滴下来，草是湿的。,shuǐ cóng shù shàng dī xià lái ， cǎo shì shī de 。
I hear that her mother is in another city.,我听说她母亲在另一个城市。,wǒ tīng shuō tā mǔ qīn zài lìng yī gè chéng shì 。
"If he is available, ask him to call me.",如果他有空，让他给我打电话。,rú guǒ tā yǒu kōng ， ràng tā gěi wǒ dǎ diàn huà 。
"It is not a bad situation, don't worry.",情况还不错，别担心。,qíng kuàng hái bù cuò ， bié dān xīn 。
My teacher is very kind.,我的老师很和蔼。,wǒ de lǎo shī hěn hé ǎi 。
I went shopping in order to buy a new jeans.,我去购物是为了买一条新牛仔裤。,wǒ qù gòu wù shì wéi le mǎi yī tiáo xīn niú zǎi kù 。
She would take the animals out before he got home tonight.,她要在他今晚回家之前把动物都带出去。,tā yào zài tā jīn wǎn huí jiā zhī qián bǎ dòng wù dōu dài chū qù 。
My dad never works on the weekends.,我爸爸周末从来不工作。,wǒ bà bà zhōu mò cóng lái bù gōng zuò 。
She writes an e-mail to her best friend.,她给她最好的朋友写了一封电子邮件。,tā gěi tā zuì hǎo de péng yǒu xiě le yī fēng diàn zǐ yóu jiàn 。
The sun rises at the east.,太阳从东方升起。,tài yáng cóng dōng fāng shēng qǐ 。
George brushes his teeth twice a day.,乔治每天刷两次牙。,qiáo zhì měi tiān shuā liǎng cì yá 。
When does the train usually leave?,火车通常什么时候开?,huǒ chē tōng cháng shén me shí hòu kāi ?
My cat runs very fast.,我的猫跑得很快。,wǒ de māo pǎo dé hěn kuài 。
He catches the train every morning.,他每天早上都赶火车。,tā měi tiān zǎo shàng dōu gǎn huǒ chē 。
He loves to play basketball.,他喜欢打篮球。,tā xǐ huān dǎ lán qiú 。
Does he go to river too?,他也去河边吗?,tā yě qù hé biān ma ?
You'd better go in and get out of those wet clothes.,你最好进去把那些湿衣服脱下来。,nǐ zuì hǎo jìn qù bǎ nà xiē shī yī fú tuō xià lái 。
It usually rains every day here.,这里通常每天都下雨。,zhè lǐ tōng cháng měi tiān dōu xià yǔ 。
It smells very delicious in the kitchen.,厨房里闻起来很香。,chú fáng lǐ wén qǐ lái hěn xiāng 。
They haven't been able to solve the problem yet.,他们还没能解决这个问题。,tā mén hái méi néng jiě jué zhè gè wèn tí 。
It's about time you spent some money on yourself.,该是你为自己花钱的时候了。,gāi shì nǐ wéi zì jǐ huā qián de shí hòu le 。
You've always taken care of us.,你一直都在照顾我们。,nǐ yī zhí dōu zài zhào gù wǒ mén 。
There was always plenty of food.,总是有充足的食物。,zǒng shì yǒu chōng zú de shí wù 。
"Be always brave and truthful, said his father.",他的父亲说，永远要勇敢和诚实。,tā de fù qīn shuō ， yǒng yuǎn yào yǒng gǎn hé chéng shí 。
Tell them to bring me a leaf.,让他们给我带一片叶子来。,ràng tā mén gěi wǒ dài yī piàn yè zǐ lái 。
Why don't you sit down and rest and I'll bring you a piece of fruit.,你为什么不坐下来休息一下，我给你拿块水果来。,nǐ wéi shén me bù zuò xià lái xiū xī yī xià ， wǒ gěi nǐ ná kuài shuǐ guǒ lái 。
"We'll meet soon, brother.",我们很快就会见面的，兄弟。,wǒ mén hěn kuài jiù huì jiàn miàn de ， xiōng dì 。
Berries are quite delicious.,浆果很好吃。,jiāng guǒ hěn hǎo chī 。
I have to find my lost key.,我得找到我丢失的钥匙。,wǒ dé zhǎo dào wǒ diū shī de yào shi 。
He put down the book and looked at the rock beneath him.,他放下书，看着脚下的岩石。,tā fàng xià shū ， kàn zhe jiǎo xià de yán shí 。
I'm glad you like it.,我很高兴你喜欢它。,wǒ hěn gāo xìng nǐ xǐ huān tā 。
We have some fruit waiting for us inside.,我们在里面准备了一些水果。,wǒ mén zài lǐ miàn zhǔn bèi le yī xiē shuǐ guǒ 。
She promised she would reserve a room for me.,她答应要为我预订一个房间。,tā dá yìng yào wéi wǒ yù dìng yī gè fáng jiān 。
Even the tiny flower petals looked vibrant.,就连小小的花瓣也显得生机勃勃。,jiù lián xiǎo xiǎo de huā bàn yě xiǎn dé shēng jī bó bó 。
Could you come by for dinner tonight?,你今晚能过来吃晚饭吗?,nǐ jīn wǎn néng guò lái chī wǎn fàn ma ?
She shivered in the chilly ocean breeze.,她在冰冷的海风中颤抖。,tā zài bīng lěng de hǎi fēng zhōng chàn dǒu 。
I must have the land checked out.,我必须把那块地检查一下。,wǒ bì xū bǎ nà kuài dì jiǎn chá yī xià 。
They can be divided into three groups.,他们可以分为三组。,tā mén kě yǐ fēn wéi sān zǔ 。
We may have good reason to be proud of ourselves.,我们有充分的理由为自己感到自豪。,wǒ mén yǒu chōng fēn de lǐ yóu wéi zì jǐ gǎn dào zì háo 。
It is necessary that he should be sent there at once.,有必要立即把他送到那里去。,yǒu bì yào lì jí bǎ tā sòng dào nà lǐ qù 。
I won't believe it unless I see it with my own eyes.,除非我亲眼看到，否则我不会相信的。,chú fēi wǒ qīn yǎn kàn dào ， fǒu zé wǒ bù huì xiāng xìn de 。
I wish I had met my uncle yesterday.,我真希望昨天见到了我叔叔。,wǒ zhēn xī wàng zuó tiān jiàn dào le wǒ shū shū 。
I won't phone my friend until they have arrived.,在他们到达之前我不会给我的朋友打电话。,zài tā mén dào dá zhī qián wǒ bù huì gěi wǒ de péng yǒu dǎ diàn huà 。
She enjoys cooking food on her own.,她喜欢自己做饭。,tā xǐ huān zì jǐ zuò fàn 。
It felt so good to be home.,回家的感觉真好。,huí jiā de gǎn jiào zhēn hǎo 。
Everything was in good order except the boots.,除了靴子以外，一切都很好。,chú le xuē zǐ yǐ wài ， yī qiē dōu hěn hǎo 。
"If you go there, you will find him.",如果你去那里，你会找到他的。,rú guǒ nǐ qù nà lǐ ， nǐ huì zhǎo dào tā de 。
A little girl said she heard about the cold breeze from around the way.,一个小女孩说她从附近听说有冷风。,yī gè xiǎo nǚ hái shuō tā cóng fù jìn tīng shuō yǒu lěng fēng 。
"Today, I see some ripe fruit on that tree.",今天，我在那棵树上看到了一些成熟的水果。,jīn tiān ， wǒ zài nà kē shù shàng kàn dào le yī xiē chéng shú de shuǐ guǒ 。
They usually spent the morning hours in the forest.,他们的早上通常在森林里度过。,tā mén de zǎo shàng tōng cháng zài sēn lín lǐ dù guò 。
Who is your best friend?,谁是你最好的朋友?,shuí shì nǐ zuì hǎo de péng yǒu ?
"She ate her fruit, took a walk, and then went back to sleep.",她吃了水果，散了步，然后又回去睡觉了。,tā chī le shuǐ guǒ ， sàn le bù ， rán hòu yòu huí qù shuì jiào le 。
"He loves to read, and he also loves to hike.",他喜欢读书，也喜欢徒步旅行。,tā xǐ huān dú shū ， yě xǐ huān tú bù lǚ háng 。
What is the true meaning of the poem?,这首诗的真正含义是什么?,zhè shǒu shī de zhēn zhèng hán yì shì shén me ?
You are showing both sides of an argumént.,你展示了一个论点的正反两面。,nǐ zhǎn shì le yī gè lùn diǎn de zhèng fǎn liǎng miàn 。
You are describing a sequence of events.,你在描述一系列的事件。,nǐ zài miáo shù yī xì liè de shì jiàn 。
I do not know a way to get to the moon.,我不知道去月球的方法。,wǒ bù zhī dào qù yuè qiú de fāng fǎ 。
The warm sun shined on the trees and drew out all their fragrance.,温暖的阳光照在树上，树的香味都散发出来了。,wēn nuǎn de yáng guāng zhào zài shù shàng ， shù de xiāng wèi dōu sàn fā chū lái le 。
I enjoyed the stone that you brought for me.,我很喜欢你给我带来的石头。,wǒ hěn xǐ huān nǐ gěi wǒ dài lái de shí tóu 。
The girl ran into the forest.,女孩跑进了森林。,nǚ hái pǎo jìn le sēn lín 。
He walked down the path.,他沿着小路走。,tā yán zhe xiǎo lù zǒu 。
She laughed at the rabbit's activities.,她嘲笑兔子的行为。,tā cháo xiào tù zǐ de háng wéi 。
Uncover the hole carefully.,小心地揭开这个洞。,xiǎo xīn de jiē kāi zhè gè dòng 。
I love the ocean because fish are so interesting to watch.,我喜欢大海，因为看鱼很有趣。,wǒ xǐ huān dà hǎi ， yīn wéi kàn yú hěn yǒu qù 。
I drink juice every morning.,我每天早上都喝果汁。,wǒ měi tiān zǎo shàng dōu hē guǒ zhī 。
There's one piece left like yesterday.,还有一件和昨天一样。,hái yǒu yī jiàn hé zuó tiān yī yàng 。
"We waited for the train, but the train was late.",我们等火车，但火车晚点了。,wǒ mén děng huǒ chē ， dàn huǒ chē wǎn diǎn le 。
The weather was wonderful with its bright sunshine.,阳光明媚，天气很好。,yáng guāng míng mèi ， tiān qì hěn hǎo 。
Many trees lost their leaves last winter.,去年冬天许多树落叶了。,qù nián dōng tiān xǔ duō shù luò yè le 。
The blue sky was cloudless.,蔚蓝的天空万里无云。,wèi lán de tiān kōng wàn lǐ wú yún 。
We walked through to the other side.,我们走到另一边。,wǒ mén zǒu dào lìng yī biān 。
Does it snow when it is sunny?,晴天的时候下雪吗?,qíng tiān de shí hòu xià xuě ma ?
Winter is over and spring has come.,冬天过去了，春天来了。,dōng tiān guò qù le ， chūn tiān lái le 。
The sky is full of stars.,天空布满了星星。,tiān kōng bù mǎn le xīng xīng 。
Where do you want to go on a hike this weekend?,这个周末你想去哪里远足?,zhè gè zhōu mò nǐ xiǎng qù nǎ lǐ yuǎn zú ?
The moon goes around the earth.,月球绕地球运行。,yuè qiú rào dì qiú yùn háng 。
It was raining yesterday.,昨天下雨了。,zuó tiān xià yǔ le 。
The clouds are getting darker.,云越来越暗了。,yún yuè lái yuè àn le 。
I saw a child standing near the waterfall.,我看见一个孩子站在瀑布附近。,wǒ kàn jiàn yī gè hái zǐ zhàn zài pù bù fù jìn 。
That one near the lake is chipping the rock.,湖边的那只正在凿石头。,hú biān de nà zhī zhèng zài záo shí tóu 。
She buried her feet in the sand to keep them warm.,她把脚埋在沙子里取暖。,tā bǎ jiǎo mái zài shā zǐ lǐ qǔ nuǎn 。
We have lovely trees around here.,我们周围有可爱的树。,wǒ mén zhōu wéi yǒu kě ài de shù 。
"There was no tree for shade in the forest, they all let the light through.",森林里没有树可以遮荫，他们都让阳光照进来。,sēn lín lǐ méi yǒu shù kě yǐ zhē yīn ， tā mén dōu ràng yáng guāng zhào jìn lái 。
The land is covered with green grass.,地上长满了绿草。,dì shàng zhǎng mǎn le lǜ cǎo 。
Do these bugs fly?,这些虫子会飞吗?,zhè xiē chóng zǐ huì fēi ma ?
He dropped the leaf into the fire.,他把树叶扔进火里。,tā bǎ shù yè rēng jìn huǒ lǐ 。
The birds drink from the still pool of water.,鸟儿从静止的池水里饮水。,niǎo ér cóng jìng zhǐ de chí shuǐ lǐ yǐn shuǐ 。
They jump into the river.,他们跳进河里。,tā mén tiào jìn hé lǐ 。
Birds are making their houses in the tree.,鸟儿正在树上筑巢。,niǎo ér zhèng zài shù shàng zhù cháo 。
Be careful of that broken branch.,小心那根折断的树枝。,xiǎo xīn nà gēn zhé duàn de shù zhī 。
My friend works in the field.,我的朋友在地里工作。,wǒ de péng yǒu zài dì lǐ gōng zuò 。
We are riding into the forest today.,我们今天要骑进森林。,wǒ mén jīn tiān yào qí jìn sēn lín 。
She ran harder up the hill.,她拼命往山上跑。,tā pīn mìng wǎng shān shàng pǎo 。
"This area has an abundant rainfall, dense forests, and fertile soil.",这个地区雨量充沛，森林茂密，土壤肥沃。,zhè gè dì qū yǔ liàng chōng pèi ， sēn lín mào mì ， tǔ rǎng féi wò 。
The first tree was near the lake.,第一棵树在湖边。,dì yī kē shù zài hú biān 。
There is beautiful land lying on both sides of the wonderful river.,这条大河的两岸都有美丽的土地。,zhè tiáo dà hé de liǎng àn dōu yǒu měi lì de tǔ dì 。
What is the highest mountain?,哪座山最高?,nǎ zuò shān zuì gāo ?
The countryside is made with beautiful hills.,乡村由美丽的山丘组成。,xiāng cūn yóu měi lì de shān qiū zǔ chéng 。
They will go up to the snowy region.,他们要到下雪的地方去。,tā mén yào dào xià xuě de dì fāng qù 。
The rock was heavy and sharp.,这块石头又重又尖。,zhè kuài shí tóu yòu zhòng yòu jiān 。
You threw the rock over the river?,你把石头扔到河上了?,nǐ bǎ shí tóu rēng dào hé shàng le ?
"Even in the dense underbrush, it had found another rock.",即使在茂密的灌木丛中，它也找到了另一块岩石。,jí shǐ zài mào mì de guàn mù cóng zhōng ， tā yě zhǎo dào le lìng yī kuài yán shí 。
The summer is the best time to prune raspberry bushes.,夏天是修剪树莓树的最佳时机。,xià tiān shì xiū jiǎn shù méi shù de zuì jiā shí jī 。
"You are staying the whole evening, I hope?",我希望你整个晚上都待在这里吧?,wǒ xī wàng nǐ zhěng gè wǎn shàng dōu dài zài zhè lǐ ba ?
"I study about the earth, and the animals.",我研究地球和动物。,wǒ yán jiū dì qiú hé dòng wù 。
"It isn't cold out there, is it?",外面不冷，是吧?,wài miàn bù lěng ， shì ba ?
"She ran and ran and ran, until the night came to a close.",她跑啊跑啊，直到夜幕降临。,tā pǎo ā pǎo ā ， zhí dào yè mù jiàng lín 。
"When she woke again, the sun was shining on her face.",当她再次醒来时，阳光正照在她的脸上。,dāng tā zài cì xǐng lái shí ， yáng guāng zhèng zhào zài tā de liǎn shàng 。
Will you give me a cup of tea?,你能给我一杯茶吗?,nǐ néng gěi wǒ yī bēi chá ma ?
Will you try it and see if it makes a difference if wouldn't mind?,如果你不介意的话，你可以试一试，看看有没有用?,rú guǒ nǐ bù jiè yì de huà ， nǐ kě yǐ shì yī shì ， kàn kàn yǒu méi yǒu yòng ?
Would you like to go on an outdoor adventure?,你想去户外冒险吗?,nǐ xiǎng qù hù wài mào xiǎn ma ?
He watched as the wolf disappeared into the tall grass.,他看着狼消失在高高的草丛中。,tā kàn zhe láng xiao shī zài gāo gāo de cǎo cóng zhōng 。
"I know you must be tired, so I will let you rest.",我知道你一定累了，所以我会让你休息。,wǒ zhī dào nǐ yī dìng lèi le ， suǒ yǐ wǒ huì ràng nǐ xiū xī 。
The dry weather was perfect for building.,干燥的天气很适合建造。,gàn zào de tiān qì hěn shì hé jiàn zào 。
Those few pieces of fat pine were a great treasure.,那几块肥的松木是一笔巨大的财富。,nà jǐ kuài féi de sōng mù shì yī bǐ jù dà de cái fù 。
The table and chairs were made of a dark rich wood.,桌子和椅子是用一种深色的木头做成的。,zhuō zǐ hé yǐ zǐ shì yòng yī zhǒng shēn sè de mù tóu zuò chéng de 。
She breathed in the ocean air.,她呼吸着海洋的空气。,tā hū xī zhe hǎi yáng de kōng qì 。
We bought a lily and set it in a sunny window.,我们买了一株百合花，把它放在阳光充足的窗前。,wǒ mén mǎi le yī zhū bǎi hé huā ， bǎ tā fàng zài yáng guāng chōng zú de chuāng qián 。
"We can't keep falling forever, you know.",我们不能一直这样下去，你知道的。,wǒ mén bù néng yī zhí zhè yàng xià qù ， nǐ zhī dào de 。
After two years' growth the bushes should be quite tall.,经过两年的生长，这些灌木应该长得相当高了。,jīng guò liǎng nián de shēng zhǎng ， zhè xiē guàn mù yìng gāi cháng dé xiāng dāng gāo le 。
She glanced around the lush hills.,她环视了一下郁郁葱葱的山丘。,tā huán shì le yī xià yù yù cōng cōng de shān qiū 。
All of the islands have beautiful beaches and lush scenery.,所有的岛屿都有美丽的海滩和郁郁葱葱的风景。,suǒ yǒu de dǎo yǔ dōu yǒu měi lì de hǎi tān hé yù yù cōng cōng de fēng jǐng 。
"The place is absolutely crammed with plants, a lush green oasis.",这里到处都是植物，一片郁郁葱葱的绿洲。,zhè lǐ dào chù dōu shì zhí wù ， yī piàn yù yù cōng cōng de lǜ zhōu 。
It is a very vibrant and proud community.,这是一个充满活力和自豪的社区。,zhè shì yī gè chōng mǎn huó lì hé zì háo de shè qū 。
The dawn brought cool air and dense fog.,黎明带来了凉爽的空气和浓雾。,lí míng dài lái le liáng shuǎng de kōng qì hé nóng wù 。
"The air was dry and hot, as if she were in a sauna.",空气又干又热，她好像在蒸桑拿。,kōng qì yòu gàn yòu rè ， tā hǎo xiàng zài zhēng sāng ná 。
Cherry blossoms are in bloom for a short period.,樱花盛开的时间很短。,yīng huā shèng kāi de shí jiān hěn duǎn 。
