sentence,hanzi,pinyin
Scorpions are numerous in the arid regions.,在干旱地区蝎子很多。,zài gàn hàn dì qū xiē zǐ hěn duō 。
"The day was sunny and mild, a perfect day for riding.",这天阳光明媚，天气温和，非常适合骑马。,zhè tiān yáng guāng míng mèi ， tiān qì wēn hé ， fēi cháng shì hé qí mǎ 。
The majestic river dashes its way towards the valley.,这条雄伟的河流冲向山谷。,zhè tiáo xióng wěi de hé liú chōng xiàng shān gǔ 。
The blossom is fragrant.,花很香。,huā hěn xiāng 。
The apple trees are looking beautiful.,这些苹果树看起来很漂亮。,zhè xiē píng guǒ shù kàn qǐ lái hěn piāo liàng 。
The birds are chirping in the trees.,鸟儿在树上鸣叫。,niǎo ér zài shù shàng míng jiào 。
The cool breeze is chilling my spine.,凉风使我的脊背发凉。,liáng fēng shǐ wǒ de jǐ bèi fā liáng 。
The tides are rushing towards the land.,潮水正涌向陆地。,cháo shuǐ zhèng yǒng xiàng lù dì 。
A calm river is flowing from the mountains.,一条平静的河流从山上流过。,yī tiáo píng jìng de hé liú cóng shān shàng liú guò 。
The pond has many flowers.,池塘里有许多花。,chí táng lǐ yǒu xǔ duō huā 。
Birds are flying around fearlessly.,鸟儿无所畏惧地飞来飞去。,niǎo ér wú suǒ wèi jù de fēi lái fēi qù 。
The frogs are trilling in the pond.,青蛙在池塘里鸣叫。,qīng wā zài chí táng lǐ míng jiào 。
The tree has long branches.,这棵树有长长的树枝。,zhè kē shù yǒu cháng cháng de shù zhī 。
"Fresh fruit, please.",新鲜水果，谢谢。,xīn xiān shuǐ guǒ ， xiè xiè 。
The sky is so amazingly beautiful today.,今天的天空美极了。,jīn tiān de tiān kōng měi jí le 。
Deer are grazing in the fields.,鹿在田野里吃草。,lù zài tián yě lǐ chī cǎo 。
The wolf is chasing the deer.,狼正在追赶那只鹿。,láng zhèng zài zhuī gǎn nà zhī lù 。
This river contains many species of fish.,这条河里有许多种鱼。,zhè tiáo hé lǐ yǒu xǔ duō zhǒng yú 。
A pack of wolves is howling in the forest.,一群狼在森林里嚎叫。,yī qún láng zài sēn lín lǐ háo jiào 。
The clouds caused a sudden blizzard.,云层引起了突然的暴风雪。,yún céng yǐn qǐ le tū rán de bào fēng xuě 。
Let us fly a kite in the bright sunshine.,让我们在明亮的阳光下放风筝吧。,ràng wǒ mén zài míng liàng de yáng guāng xià fàng fēng zhēng ba 。
The bugs are making weird noises.,虫子发出奇怪的声音。,chóng zǐ fā chū qí guài de shēng yīn 。
The mighty river is flowing along the slopes of the mountains.,这条大河沿着山坡流淌。,zhè tiáo dà hé yán zhe shān pō liú tǎng 。
We are approaching a valley.,我们正在接近一个山谷。,wǒ mén zhèng zài jiē jìn yī gè shān gǔ 。
The great wind hit the valley.,大风袭击了山谷。,dà fēng xí jī le shān gǔ 。
Look at the colorful butterflies!,看那些五颜六色的蝴蝶!,kàn nà xiē wǔ yán liù sè de hú dié !
The birds are cool looking.,这些鸟看起来很酷。,zhè xiē niǎo kàn qǐ lái hěn kù 。
The rabbits are hopping joyously.,兔子们高兴地跳着。,tù zǐ mén gāo xìng de tiào zhe 。
The talkative bird is curious.,这只多嘴的鸟很好奇。,zhè zhī duō zuǐ de niǎo hěn hǎo qí 。
The coyote is witty.,这只狼很机智。,zhè zhī láng hěn jī zhì 。
The mice are squeaking happily.,老鼠高兴地吱吱叫着。,lǎo shǔ gāo xìng de zhī zhī jiào zhe 。
Snow is dripping from the leaves.,雪从树叶上滴下来。,xuě cóng shù yè shàng dī xià lái 。
Birds are drinking water from the unusually still river.,鸟儿们正在从异常平静的河里喝水。,niǎo ér mén zhèng zài cóng yì cháng píng jìng de hé lǐ hē shuǐ 。
Rabbits hop merrily.,兔子跳得很欢快。,tù zǐ tiào dé hěn huān kuài 。
This particular rabbit was pretty quick at finding some food.,这只兔子很快就找到了食物。,zhè zhī tù zǐ hěn kuài jiù zhǎo dào le shí wù 。
The bird builds its nest quickly from twigs.,鸟在小树枝上很快地筑巢。,niǎo zài xiǎo shù zhī shàng hěn kuài de zhù cháo 。
The fluffy bear fishes in the stream.,毛茸茸的熊在小溪里钓鱼。,máo róng róng de xióng zài xiǎo xī lǐ diào yú 。
The bear snores peacefully.,熊安静地打鼾。,xióng ān jìng de dǎ hān 。
The unstable rock rolls down the mountains.,不稳定的岩石从山上滚下来。,bù wěn dìng de yán shí cóng shān shàng gǔn xià lái 。
The flowers blossom blissfully.,花儿开得很幸福。,huā ér kāi dé hěn xìng fú 。
The lush green forest has a lot of animals in it.,郁郁葱葱的森林里有很多动物。,yù yù cōng cōng de sēn lín lǐ yǒu hěn duō dòng wù 。
Do you want to talk while we're playing?,我们玩的时候你想聊聊吗?,wǒ mén wán de shí hòu nǐ xiǎng liáo liáo ma ?
Fruit is currently being harvested as we eat.,正在我们吃的时候，水果在被收割。,zhèng zài wǒ mén chī de shí hòu ， shuǐ guǒ zài bèi shōu gē 。
Fresh berries are scattered across the land.,新鲜的浆果散布在各地。,xīn xiān de jiāng guǒ sàn bù zài gè dì 。
The moths flock to the light like crazy.,飞蛾疯狂地涌向光。,fēi é fēng kuáng de yǒng xiàng guāng 。
Wavy branches make fill the day with joy.,波浪形的树枝使一天充满了欢乐。,bō làng xíng de shù zhī shǐ yī tiān chōng mǎn le huān lè 。
The ducks quack happily.,鸭子们高兴地嘎嘎叫。,yā zǐ mén gāo xìng de gǎ gǎ jiào 。
The birds are at rest.,鸟儿们休息了。,niǎo ér mén xiū xī le 。
Reptiles lay under the canopy of the forest.,爬行动物躺在森林的树冠下。,pá háng dòng wù tǎng zài sēn lín de shù guàn xià 。
Butterflies sit on the shrubs.,蝴蝶栖息在灌木上。,hú dié qī xī zài guàn mù shàng 。
The rabbit is lying on his back playfully.,兔子正躺在他的背上玩耍。,tù zǐ zhèng tǎng zài tā de bèi shàng wán shuǎ 。
I hope the birds would sing while we play in the grass.,我希望我们在草地上玩耍时鸟儿会唱歌。,wǒ xī wàng wǒ mén zài cǎo dì shàng wán shuǎ shí niǎo ér huì chàng gē 。
"No, I don't see why that should be.",不，我不明白为什么会这样。,bù ， wǒ bù míng bái wéi shén me huì zhè yàng 。
"First we wait, then we move.",我们先等，然后再行动。,wǒ mén xiān děng ， rán hòu zài háng dòng 。
"I've never tried that, should be interesting!",我从来没试过，应该很有趣!,wǒ cóng lái méi shì guò ， yìng gāi hěn yǒu qù !
"If we could, we should, why wouldn't we?",如果可以，我们就应该这么做，为什么不呢?,rú guǒ kě yǐ ， wǒ mén jiù yìng gāi zhè me zuò ， wéi shén me bù ne ?
She speaks as if everyone was asleep.,她说话时好像每个人都睡着了。,tā shuō huà shí hǎo xiàng měi gè rén dōu shuì zhe le 。
"No wonder the birds sing, they sound great!",难怪鸟儿唱歌，它们听起来很棒!,nán guài niǎo ér chàng gē ， tā mén tīng qǐ lái hěn bàng !
What is your favorite thing to do?,你最喜欢做什么?,nǐ zuì xǐ huān zuò shén me ?
"The moon shines too, just not as much.",月亮也照耀着，只是没有那么明亮。,yuè liàng yě zhào yào zhe ， zhǐ shì méi yǒu nà me míng liàng 。
If only we could jump and reach the skies.,要是我们能跳上天空就好了。,yào shì wǒ mén néng tiào shàng tiān kōng jiù hǎo le 。
Let's get there by running.,让我们跑着去那里。,ràng wǒ mén pǎo zhe qù nà lǐ 。
We are going to explore the forest tomorrow.,我们明天要去森林里探险。,wǒ mén míng tiān yào qù sēn lín lǐ tàn xiǎn 。
We are from the beach.,我们来自海滩。,wǒ mén lái zì hǎi tān 。
"Here, let me get that for you.",来，我帮你拿。,lái ， wǒ bāng nǐ ná 。
I want to be tall when I grow up.,我长大后想长得高。,wǒ zhǎng dà hòu xiǎng cháng dé gāo 。
A gentle breeze is clearing away all the leaves.,一阵微风吹走了所有的树叶。,yī zhèn wēi fēng chuī zǒu le suǒ yǒu de shù yè 。
"Take these rocks, they are yours.",把这些石头拿走，它们是你的。,bǎ zhè xiē shí tóu ná zǒu ， tā mén shì nǐ de 。
Remind your brother to take you out when he wakes up.,提醒你弟弟醒来时带你出去。,tí xǐng nǐ dì dì xǐng lái shí dài nǐ chū qù 。
It is time to relax and enjoy.,是时候放松和享受了。,shì shí hòu fàng sōng hé xiǎng shòu le 。
The snow is very welcoming.,雪很宜人。,xuě hěn yí rén 。
I need a light sleep in the afternoon.,我下午需要好好睡一觉。,wǒ xià wǔ xū yào hǎo hǎo shuì yī jiào 。
We are planning a trip to the forest.,我们计划去森林旅行。,wǒ mén jì huá qù sēn lín lǚ háng 。
The fruit we are having today is from the forest.,我们今天吃的水果来自森林。,wǒ mén jīn tiān chī de shuǐ guǒ lái zì sēn lín 。
They are coming over to play.,他们要过来玩。,tā mén yào guò lái wán 。
Think of any number from one to ten.,想想从一到十的任何数字。,xiǎng xiǎng cóng yī dào shí de rèn hé shù zì 。
It's time to go home.,该回家了。,gāi huí jiā le 。
Imagine the purple leaves.,想象一下紫色的叶子。,xiǎng xiàng yī xià zǐ sè de yè zǐ 。
Get some ice cubes for the juice.,拿些冰块来做果汁。,ná xiē bīng kuài lái zuò guǒ zhī 。
"Get me two stones: one brown, the other white.",给我拿两块石头，一块棕色的，另一块白色的。,gěi wǒ ná liǎng kuài shí tóu ， yī kuài zōng sè de ， lìng yī kuài bái sè de 。
I will be swimming with the fish.,我将和鱼一起游泳。,wǒ jiāng hé yú yī qǐ you yǒng 。
Watch closely!,密切关注!,mì qiē guān zhù !
Let's go find some fruit.,我们去找些水果吧。,wǒ mén qù zhǎo xiē shuǐ guǒ ba 。
Can we climb that tree?,我们能爬上那棵树吗?,wǒ mén néng pá shàng nà kē shù ma ?
Yesterday was fun because we found that big rock.,昨天很有趣，因为我们发现了那块大石头。,zuó tiān hěn yǒu qù ， yīn wéi wǒ mén fā xiàn le nà kuài dà shí tóu 。
Let us finish this before the sun sets.,让我们在太阳落山前完成这件事。,ràng wǒ mén zài tài yáng luò shān qián wán chéng zhè jiàn shì 。
I love having fruit in the afternoon.,我喜欢在下午吃水果。,wǒ xǐ huān zài xià wǔ chī shuǐ guǒ 。
When can you come out to play?,你什么时候可以出来玩?,nǐ shén me shí hòu kě yǐ chū lái wán ?
I am always at home at weekends.,周末我总是在家。,zhōu mò wǒ zǒng shì zài jiā 。
You can be the best at anything you can imagine.,你可以在任何你能想到的事情上做到最好。,nǐ kě yǐ zài rèn hé nǐ néng xiǎng dào de shì qíng shàng zuò dào zuì hǎo 。
It gets dark when the lights turn off.,灯一关天就黑了。,dēng yī guān tiān jiù hēi le 。
Our dad gives us fruit every day.,我们的爸爸每天给我们水果。,wǒ mén de bà bà měi tiān gěi wǒ mén shuǐ guǒ 。
Animals sleep all the time.,动物一直都在睡觉。,dòng wù yī zhí dōu zài shuì jiào 。
We all love playing games.,我们都喜欢玩游戏。,wǒ mén dōu xǐ huān wán you xì 。
We crossed the river with our bare feet.,我们光着脚过河。,wǒ mén guāng zhe jiǎo guò hé 。
Place the fruit peel into the pile.,将果皮放成一堆。,jiāng guǒ pí fàng chéng yī duī 。
My feet got wet from the rain.,我的脚被雨淋湿了。,wǒ de jiǎo bèi yǔ lín shī le 。
I found two branches had fallen from the tree.,我发现有两根树枝从树上掉了下来。,wǒ fā xiàn yǒu liǎng gēn shù zhī cóng shù shàng diào le xià lái 。
The wolf howled all night.,狼嚎叫了一整夜。,láng háo jiào le yī zhěng yè 。
Let's give them another chance.,我们再给他们一次机会吧。,wǒ mén zài gěi tā mén yī cì jī huì ba 。
Keep sight of where you are going.,注意你要去的地方。,zhù yì nǐ yào qù de dì fāng 。
"I don't take sugar in my tea, thanks.",我的茶里不加糖，谢谢。,wǒ de chá lǐ bù jiā táng ， xiè xiè 。
Feel free to visit me anytime.,随时欢迎来访。,suí shí huān yíng lái fǎng 。
Her voice sounded so happy.,她的声音听起来很幸福。,tā de shēng yīn tīng qǐ lái hěn xìng fú 。
We are going to clean everything up.,我们要把一切都清理干净。,wǒ mén yào bǎ yī qiē dōu qīng lǐ gàn jìng 。
Let's meet at our tree house when the sun rises.,太阳升起的时候我们在树屋里见吧。,tài yáng shēng qǐ de shí hòu wǒ mén zài shù wū lǐ jiàn ba 。
Can you make tea for us?,你能为我们泡茶吗?,nǐ néng wéi wǒ mén pào chá ma ?
I must follow my dream where ever it takes me.,我必须追随我的梦想，无论代价如何。,wǒ bì xū zhuī suí wǒ de mèng xiǎng ， wú lùn dài jià rú hé 。
We thanked our teacher for all her hard work.,我们感谢老师的辛勤工作。,wǒ mén gǎn xiè lǎo shī de xīn qín gōng zuò 。
Let's get started right away.,让我们马上开始吧。,ràng wǒ mén mǎ shàng kāi shǐ ba 。
Let everyone have what they want.,让每个人都得到他们想要的。,ràng měi gè rén dōu dé dào tā mén xiǎng yào de 。
The leaves are scattered all over the forest floor.,树叶散落在森林的地面上。,shù yè sàn luò zài sēn lín de dì miàn shàng 。
The fruits are all small and green.,这些水果又小又绿。,zhè xiē shuǐ guǒ yòu xiǎo yòu lǜ 。
Would you please pour me a glass of the juice you made.,请你给我倒一杯你做的果汁好吗?,qǐng nǐ gěi wǒ dǎo yī bēi nǐ zuò de guǒ zhī hǎo ma ?
The rabbits are enjoying their meal.,兔子们正在享用它们的食物。,tù zǐ mén zhèng zài xiǎng yòng tā mén de shí wù 。
Keep the windows slightly open.,让窗户稍微开着。,ràng chuāng hù shāo wēi kāi zhe 。
Who let the animals out?,谁把动物放出来的?,shuí bǎ dòng wù fàng chū lái de ?
Try to remember what happened.,试着回忆一下发生了什么。,shì zhe huí yì yī xià fā shēng le shén me 。
I came here for you.,我是来找你的。,wǒ shì lái zhǎo nǐ de 。
We both took a piece of fruit.,我们都拿了一块水果。,wǒ mén dōu ná le yī kuài shuǐ guǒ 。
We all sat watching the sun rise.,我们都坐着看日出。,wǒ mén dōu zuò zhe kàn rì chū 。
She is a very polite young girl.,她是一个很有礼貌的年轻女孩。,tā shì yī gè hěn yǒu lǐ mào de nián qīng nǚ hái 。
Bring everything to me.,把所有的东西都带给我。,bǎ suǒ yǒu de dōng xī dōu dài gěi wǒ 。
The birds chirped as they were fed.,鸟儿吃东西时叽叽喳喳地叫。,niǎo ér chī dōng xī shí jī jī zhā zhā de jiào 。
I have a variety of different collections.,我有各种不同的收藏。,wǒ yǒu gè zhǒng bù tóng de shōu cáng 。
Take care of your siblings.,照顾好你的兄弟姐妹。,zhào gù hǎo nǐ de xiōng dì jiě mèi 。
We counted twelve branches in total.,我们总共数了十二根树枝。,wǒ mén zǒng gòng shù le shí èr gēn shù zhī 。
Winter is coming.,冬天即将来临。,dōng tiān jí jiāng lái lín 。
They love the snow so much.,他们非常喜欢雪。,tā mén fēi cháng xǐ huān xuě 。
I brought some rocks with me.,我带来了一些石头。,wǒ dài lái le yī xiē shí tóu 。
Every life is sacred.,每个生命都是神圣的。,měi gè shēng mìng dōu shì shén shèng de 。
I can't run that fast.,我跑不了那么快。,wǒ pǎo bù le nà me kuài 。
The sun is shining quite brightly today.,今天阳光明媚。,jīn tiān yáng guāng míng mèi 。
These berries are very fresh.,这些浆果很新鲜。,zhè xiē jiāng guǒ hěn xīn xiān 。
The sky is clear today.,今天天空晴朗。,jīn tiān tiān kōng qíng lǎng 。
There are many species of plants in the forest.,森林里有许多种植物。,sēn lín lǐ yǒu xǔ duō zhǒng zhí wù 。
You can see dew on leaves early in the morning.,清晨，你可以在树叶上看到露珠。,qīng chén ， nǐ kě yǐ zài shù yè shàng kàn dào lù zhū 。
The land is filled with flowers.,地上开满了花。,dì shàng kāi mǎn le huā 。
"Look, there is a deer in the woods.",看，树林里有一只鹿。,kàn ， shù lín lǐ yǒu yī zhī lù 。
What kind of bird is this?,这是什么鸟?,zhè shì shén me niǎo ?
"The mountain is very steep, so be careful while climbing it.",这座山很陡，所以攀登时要小心。,zhè zuò shān hěn dǒu ， suǒ yǐ pān dēng shí yào xiǎo xīn 。
Let's drink fresh water from the lake.,让我们喝湖里的淡水。,ràng wǒ mén hē hú lǐ de dàn shuǐ 。
The pond is filled with fish of all kinds.,池塘里满是各种各样的鱼。,chí táng lǐ mǎn shì gè zhǒng gè yàng de yú 。
Flowers are in full bloom at this time of the year.,每年这个时候鲜花盛开。,měi nián zhè gè shí hòu xiān huā shèng kāi 。
The weather gets beautiful in spring.,春天天气变好了。,chūn tiān tiān qì biàn hǎo le 。
"Full moon occurs roughly once a month, except on a blue moon.",满月大约每个月出现一次，除了蓝月亮。,mǎn yuè dà yuē měi gè yuè chū xiàn yī cì ， chú le lán yuè liàng 。
The sky is filled with stars tonight.,今晚的天空布满了星星。,jīn wǎn de tiān kōng bù mǎn le xīng xīng 。
I think I love all of the flowers around here.,我喜欢这里所有的花。,wǒ xǐ huān zhè lǐ suǒ yǒu de huā 。
I like to eat.,我喜欢吃。,wǒ xǐ huān chī 。
It's a beautiful view from the top of this mountain.,从这座山顶可以看到美丽的景色。,cóng zhè zuò shān dǐng kě yǐ kàn dào měi lì de jǐng sè 。
"You should sing more often, you have such a beautiful voice.",你应该多唱歌，你有这么好的嗓子。,nǐ yìng gāi duō chàng gē ， nǐ yǒu zhè me hǎo de sǎng zǐ 。
We should dance together to this song.,我们应该随着这首歌一起跳舞。,wǒ mén yìng gāi suí zhe zhè shǒu gē yī qǐ tiào wǔ 。
The flower was usually found in the back of the forest.,这种花通常是在森林深处发现的。,zhè zhǒng huā tōng cháng shì zài sēn lín shēn chù fā xiàn de 。
The wind blew the leaves lying on the ground.,风把地上的树叶吹走了。,fēng bǎ dì shàng de shù yè chuī zǒu le 。
What are you bringing to eat on this adventure?,这次冒险你要带什么吃的?,zhè cì mào xiǎn nǐ yào dài shén me chī de ?
The bird drank water from the lake.,这只鸟喝了湖里的水。,zhè zhī niǎo hē le hú lǐ de shuǐ 。
Is it possible to swim with fishes in the sea?,在海里能和鱼一起游泳吗?,zài hǎi lǐ néng hé yú yī qǐ you yǒng ma ?
Stars sparkle at night.,星星在夜晚闪烁。,xīng xīng zài yè wǎn shǎn shuò 。
She has deep blue eyes.,她有一双深蓝色的眼睛。,tā yǒu yī shuāng shēn lán sè de yǎn jīng 。
Heavy mist covered the magical place from being seen.,浓雾笼罩着这个神奇的地方，使人看不见。,nóng wù lóng zhào zhe zhè gè shén qí de dì fāng ， shǐ rén kàn bù jiàn 。
It will rain today.,今天会下雨。,jīn tiān huì xià yǔ 。
Wild animals live out here.,野生动物生活在这里。,yě shēng dòng wù shēng huó zài zhè lǐ 。
Summer days are long and hot.,夏天漫长而炎热。,xià tiān màn cháng ér yán rè 。
The bee uses its beautiful wings to fly.,蜜蜂用它美丽的翅膀飞翔。,mì fēng yòng tā měi lì de chì páng fēi xiáng 。
Light from the star twinkles at night.,星星的光在夜晚闪烁。,xīng xīng de guāng zài yè wǎn shǎn shuò 。
The sky is covered with heavy clouds today.,今天天空布满了乌云。,jīn tiān tiān kōng bù mǎn le wū yún 。
The bear living in the forest likes to eat everything.,生活在森林里的熊喜欢吃所有的东西。,shēng huó zài sēn lín lǐ de xióng xǐ huān chī suǒ yǒu de dōng xī 。
The rock is extremely heavy.,岩石非常重。,yán shí fēi cháng zhòng 。
Waves can be seen from the beach.,从海滩上可以看到海浪。,cóng hǎi tān shàng kě yǐ kàn dào hǎi làng 。
Do you like reading the tree rings?,你喜欢看年轮吗?,nǐ xǐ huān kàn nián lún ma ?
The duck swims in the pond.,鸭子在池塘里游泳。,yā zǐ zài chí táng lǐ you yǒng 。
He plays the flute very well.,他的笛子吹得很好。,tā de dí zǐ chuī dé hěn hǎo 。
She lives in a big beautiful house.,她住在一所漂亮的大房子里。,tā zhù zài yī suǒ piāo liàng de dà fáng zǐ lǐ 。
Red berries are the ripe ones.,红色的浆果是成熟的。,hóng sè de jiāng guǒ shì chéng shú de 。
The green grass covered the lawn.,绿草覆盖着草坪。,lǜ cǎo fù gài zhe cǎo píng 。
The sky is clear and blue in summer.,夏天的天空晴朗而蔚蓝。,xià tiān de tiān kōng qíng lǎng ér wèi lán 。
These berries are freshly picked from the tree.,这些浆果是刚从树上摘下来的。,zhè xiē jiāng guǒ shì gāng cóng shù shàng zhāi xià lái de 。
The forest floor hides many little animals.,森林的地面上藏着许多小动物。,sēn lín de dì miàn shàng cáng zhe xǔ duō xiǎo dòng wù 。
Birds have the ability to fly.,鸟有飞翔的能力。,niǎo yǒu fēi xiáng de néng lì 。
This mountain will lead you to view number two.,这座山会带你去二号景点。,zhè zuò shān huì dài nǐ qù èr hào jǐng diǎn 。
Wolves have a strong sense of smell.,狼有很强的嗅觉。,láng yǒu hěn qiáng de xiù jiào 。
All the trees are covered in snow in winter.,冬天所有的树都被雪覆盖着。,dōng tiān suǒ yǒu de shù dōu bèi xuě fù gài zhe 。
How many members are there in your family?,你家有几口人?,nǐ jiā yǒu jǐ kǒu rén ?
Children like to build stuff when they are on the beach.,孩子们在海滩上时喜欢建东西。,hái zǐ mén zài hǎi tān shàng shí xǐ huān jiàn dōng xī 。
He stayed in the cool and dark cave to avoid getting wet in the rain.,他呆在又冷又黑的洞里，以免被雨淋湿。,tā dāi zài yòu lěng yòu hēi de dòng lǐ ， yǐ miǎn bèi yǔ lín shī 。
"Let's play hide and seek, it will be fun.",让我们玩捉迷藏吧，会很有趣的。,ràng wǒ mén wán zhuō mí cáng ba ， huì hěn yǒu qù de 。
What are you making tonight?,你今晚要做什么?,nǐ jīn wǎn yào zuò shén me ?
I love my family.,我爱我的家庭。,wǒ ài wǒ de jiā tíng 。
The food from the forest was delicious.,森林里的食物很好吃。,sēn lín lǐ de shí wù hěn hǎo chī 。
How often does a bird flap its wings?,一只鸟多久扇动一次翅膀?,yī zhī niǎo duō jiǔ shàn dòng yī cì chì páng ?
It is very important to stay warm in winter.,冬天保暖是很重要的。,dōng tiān bǎo nuǎn shì hěn zhòng yào de 。
My best friend gave me a piece of fresh fruit.,我最好的朋友给了我一块新鲜的水果。,wǒ zuì hǎo de péng yǒu gěi le wǒ yī kuài xīn xiān de shuǐ guǒ 。
Flowers blossom on the tree every spring.,每年春天树上都会开花。,měi nián chūn tiān shù shàng dōu huì kāi huā 。
I often dream about magical creatures at night.,我经常在晚上梦见神奇的生物。,wǒ jīng cháng zài wǎn shàng mèng jiàn shén qí de shēng wù 。
The land was filled with short bushes.,地上长满了矮灌木。,dì shàng zhǎng mǎn le ǎi guàn mù 。
Sweet juice is a very refreshing treat on a hot day.,在热天喝甜果汁是一种提神的饮料。,zài rè tiān hē tián guǒ zhī shì yī zhǒng tí shén de yǐn liào 。
The gold glimmered in the dark.,金子在黑暗中闪闪发光。,jīn zǐ zài hēi àn zhōng shǎn shǎn fā guāng 。
Water bubbles when it boils.,水沸腾时会起泡。,shuǐ fèi téng shí huì qǐ pào 。
People of this town are very nice and helpful.,这个镇上的人都很友好，乐于助人。,zhè gè zhèn shàng de rén dōu hěn yǒu hǎo ， lè yú zhù rén 。
Animals have a very special place in my heart.,动物在我心中有非常特殊的位置。,dòng wù zài wǒ xīn zhōng yǒu fēi cháng tè shū de wèi zhì 。
Fully ripened berries are sweet and delicious.,成熟的浆果香甜可口。,chéng shú de jiāng guǒ xiāng tián kě kǒu 。
The bird has a nest on the branch of this tree.,这只鸟在这棵树的树枝上有一个巢。,zhè zhī niǎo zài zhè kē shù de shù zhī shàng yǒu yī gè cháo 。
This short path will get you to the hill in no time.,这条小路很快就能把你送到山上。,zhè tiáo xiǎo lù hěn kuài jiù néng bǎ nǐ sòng dào shān shàng 。
Are you free this afternoon?,你今天下午有空吗?,nǐ jīn tiān xià wǔ yǒu kōng ma ?
Insects often live in humid climates.,昆虫通常生活在潮湿的气候条件下。,kūn chóng tōng cháng shēng huó zài cháo shī de qì hòu tiáo jiàn xià 。
You should come the tall tree and meet me sometimes.,有时候你应该到那棵高高的树上来见我。,yǒu shí hòu nǐ yìng gāi dào nà kē gāo gāo de shù shàng lái jiàn wǒ 。
